{
  "$schema": "https://json-schema.org/draft/2020-12/schema",
  "$id": "contracts/regime_brief.schema.v1.json",
  "title": "RegimeBrief",
  "type": "object",
  "additionalProperties": false,
  "required": [
    "schema_version",
    "as_of",
    "focus_list",
    "today_catalysts",
    "recent_catalysts",
    "price_moves",
    "data_coverage"
  ],
  "properties": {
    "schema_version": { "type": "integer", "const": 1 },
    "as_of": { "type": "string", "pattern": "^\\d{4}-\\d{2}-\\d{2}$" },
    "focus_list": {
      "type": "array",
      "items": {
        "type": "object",
        "additionalProperties": false,
        "required": [
          "ticker",
          "score",
          "reasons",
          "has_catalyst_today",
          "has_recent_catalyst"
        ],
        "properties": {
          "ticker": { "type": "string" },
          "score": { "type": "number" },
          "reasons": {
            "type": "array",
            "minItems": 2,
            "maxItems": 5,
            "items": { "type": "string", "minLength": 3, "maxLength": 200 }
          },
          "has_catalyst_today": { "type": "boolean" },
          "has_recent_catalyst": { "type": "boolean" }
        }
      }
    },
    "today_catalysts": {
      "type": "array",
      "items": {
        "type": "object",
        "additionalProperties": false,
        "required": [
          "ticker",
          "event_date",
          "event_type",
          "form",
          "filing_date",
          "acceptance_datetime",
          "accession_number",
          "url_filing_detail"
        ],
        "properties": {
          "ticker": { "type": "string" },
          "event_date": { "type": "string", "pattern": "^\\d{4}-\\d{2}-\\d{2}$" },
          "event_type": { "type": "string", "const": "sec_filing" },
          "form": { "type": "string", "enum": ["10-K", "10-Q", "8-K"] },
          "filing_date": { "type": "string", "pattern": "^\\d{4}-\\d{2}-\\d{2}$" },
          "acceptance_datetime": {
            "type": ["string", "null"],
            "pattern": "^\\d{4}-\\d{2}-\\d{2}T\\d{2}:\\d{2}:\\d{2}Z$"
          },
          "accession_number": { "type": "string" },
          "url_filing_detail": {
            "type": "string",
            "pattern": "^https://www\\.sec\\.gov/Archives/edgar/data/"
          }
        }
      }
    },
    "recent_catalysts": {
      "type": "array",
      "items": { "$ref": "#/properties/today_catalysts/items" }
    },
    "price_moves": {
      "type": "array",
      "items": {
        "type": "object",
        "additionalProperties": false,
        "required": ["ticker", "close", "pct_1d", "pct_5d"],
        "properties": {
          "ticker": { "type": "string" },
          "close": { "type": "number" },
          "pct_1d": { "type": ["number", "null"] },
          "pct_5d": { "type": ["number", "null"] }
        }
      }
    },
    "data_coverage": {
      "type": "object",
      "additionalProperties": false,
      "required": [
        "prices_rows",
        "filings_rows",
        "catalysts_rows",
        "tickers_in_prices",
        "tickers_in_filings",
        "tickers_in_catalysts",
        "as_of_has_prices"
      ],
      "properties": {
        "prices_rows": { "type": "integer" },
        "filings_rows": { "type": "integer" },
        "catalysts_rows": { "type": "integer" },
        "tickers_in_prices": { "type": "array", "items": { "type": "string" } },
        "tickers_in_filings": { "type": "array", "items": { "type": "string" } },
        "tickers_in_catalysts": { "type": "array", "items": { "type": "string" } },
        "as_of_has_prices": { "type": "boolean" }
      }
    }
  }
}
